query,question_text,output,flag,username,timestamp
microcredit,what's the current situation in microcredit in bangladesh?,,,,2024-02-16 11:51:41.398707
microcredit,what's the current situation in microcredit in bangladesh?,"Based on the provided context, the current situation regarding microcredit in Bangladesh is complex and multifaceted. Here are some key points that can be inferred from the provided documents:

1. Microcredit programs are available in the Haor region of Bangladesh: The documents mention different microcredit programs operating in the Haor region, indicating that access to microcredit is possible for people living in this area.
2. Conditions of microcredit vary between formal and informal programs: The documents highlight the existence of both formal and informal microcredit programs in the Haor region. While formal programs may offer more structured and regulated lending, informal programs may be more accessible to marginalized groups.
3. Impact of microcredit on poverty reduction is mixed: The documents mention studies that have found both positive and negative impacts of microcredit on poverty reduction in Bangladesh. While some studies suggest that microcredit can help reduce poverty, others indicate that it may not always lead to sustainable improvements in livelihoods.
4. Repayment challenges persist: One study found that 40% of microcredit recipients could not repay their loans, highlighting the potential for vicious cycles of debt.
5. Income and access to finance remain major concerns: The documents mention that income and access to finance are ongoing challenges for people in the Haor region. This suggests that microcredit may not always address the root causes of poverty, and other interventions may be necessary to achieve sustainable development.
6. Further research is needed: The documents emphasize the need for further research to better understand the impacts of microcredit in Bangladesh, particularly in the Haor region. This suggests that there is ongoing interest in examining the effectiveness and potential of microcredit as a poverty reduction strategy.

In summary, the current situation regarding microcredit in Bangladesh is complex, with both positive and negative impacts observed in different studies. While access to microcredit can be a valuable tool for reducing poverty, challenges related to repayment and income inequality persist. Further research is needed to better understand the potential of microcredit as a development strategy.",,,2024-02-16 11:56:13.463262
